{
  "protocol": "shm",
  "impl_type": "callback",
  "name": "hakoniwa_shared_memory",
  "direction": "inout",
  "io": {
    "robots": [
      {
        "name": "Drone",
        "pdu": [
          {"name": "pos", "notify_on_recv": true },
          {"name": "motor", "notify_on_recv": false }
        ]
      }
    ]
  }
}
