{
    "protocol": "websocket",
    "role": "server",
    "direction": "in",
    "local": {
        "port": 8080
    },
    "options": {
        "connect_timeout_ms": 5000,
        "read_timeout_ms": 5000,
        "write_timeout_ms": 5000,
        "ping_interval_sec": 30,
        "handshake_timeout_ms": 5000
    }
}
