{
  "protocol": "rmw_zenoh",
  "name": "rmw_zenoh_sub",
  "direction": "in",
  "rmw_zenoh": {
    "config_path": "zenoh/peer_listen.json5",
    "domain_id": 0,
    "mappings": [
      {
        "endpoint": {
          "robot": "StorageDemo",
          "pdu": "sample_state",
          "notify_on_recv": true
        },
        "ros2": {
          "topic": "/sample_state",
          "type_hash": "RIHS01_TEST_HASH"
        }
      }
    ]
  }
}
