{
  "protocol": "zenoh",
  "name": "python_zenoh_raspberry_pi",
  "direction": "inout",
  "zenoh": {
    "config_path": "zenoh/raspberry_pi_client.json5",
    "key_prefix": "hakoniwa",
    "io": {
      "robots": [
        {
          "name": "demo",
          "pdu": [
            {
              "name": "command",
              "notify_on_recv": true
            },
            {
              "name": "debuginfo",
              "notify_on_recv": true
            }
          ]
        }
      ]
    }
  }
}
